faq_id,title,content,key_num
1,"1) While I understand that EV stands for ""Electric Vehicle,"" could you provide explanations for the acronyms PHEV, HEV, BEV, ZEV, and ICE?","PHEV denotes Plug-in Hybrid Electric Vehicle, catering to those transitioning from traditional fuel vehicles but not fully embracing electric ones. HEV, or Hybrid Electric Vehicle, features both a gas engine and battery, replenishing the latter through r...",1
2,2) Are electric vehicles from Ford more expensive than their gas engine counterparts?,"The initial cost varies by model, but generally, EVs necessitate less maintenance and have lower long-term fuel expenses, offsetting the purchase price. For instance, EVs eliminate the need for routine oil changes, and studies indicate that EV drivers sp...",1
3,3) What is the range of Ford electric cars?,"Ranges depend on factors like model, trim, driving habits, conditions, and upgrades:**",1
4,4) How long does it take to charge an electric Ford vehicle?,"Charging times vary based on battery size, remaining charge, and method. Level 3 fast-charging may take 30-60 minutes, while level 1 standard home-charging ranges from 8-20 hours.***",1
5,5) Where can Ford electric cars be charged?,"EVs can be charged at home using installed stations for convenient overnight charging. Public charging stations, growing rapidly, are found at various locations such as shopping centers, highways, workplaces, hotels, and restaurants. Tools like Chargefin...",1
6,6) Can EV batteries be recycled?,"Once an electric vehicle's battery components reach the end of their lifespan (typically after at least 10 years), recycling becomes possible. While not every part is recyclable, advancements aim for up to 90% EV battery recycling, minimizing environment...",1
7,7) Can electric models tow?,Yes. Here are some EV models that can tow:**,1
8,8) Are there government incentives for electric car buyers?,"Incentives vary by model and location, and policies evolve. It's advisable to contact our sales representatives or refer to external resources, such as the IRS website, for the latest information.",1
9,9) Which electric models are available from Ford?,"As EV offerings evolve, check our latest electric vehicle inventory for the most up-to-date selection and features. Contact us for additional information on available models.",1
